<xs:schema attributeFormDefault="unqualified" elementFormDefault="qualified" targetNamespace="automationSchema.xsd" xmlns:xs="http://www.w3.org/2001/XMLSchema">
    <xs:element name="automation">
        <xs:annotation>
            <xs:documentation>~  Copyright (c) 2005-2014, WSO2 Inc. (http://wso2.com) All Rights Reserved.
                ~
                ~  WSO2 Inc. licenses this file to you under the Apache License,
                ~  Version 2.0 (the "License"); you may not use this file except
                ~  in compliance with the License.
                ~  You may obtain a copy of the License at
                ~
                ~    http://www.apache.org/licenses/LICENSE-2.0
                ~
                ~  Unless required by applicable law or agreed to in writing,
                ~  software distributed under the License is distributed on an
                ~  "AS IS" BASIS, WITHOUT WARRANTIES OR CONDITIONS OF ANY
                ~  KIND, either express or implied.  See the License for the
                ~  specific language governing permissions and limitations
                ~  under the License.</xs:documentation>
        </xs:annotation>
        <xs:complexType>
            <xs:sequence>
                <xs:element name="role" maxOccurs="unbounded" minOccurs="0">
                    <xs:complexType>
                        <xs:sequence>
                            <xs:element type="xs:string" name="roleName"/>
                            <xs:element type="xs:string" name="isSharedRole"/>
                            <xs:element name="user" maxOccurs="unbounded" minOccurs="0">
                                <xs:complexType>
                                    <xs:simpleContent>
                                        <xs:extension base="xs:string">
                                            <xs:attribute type="xs:string" name="key" use="optional"/>
                                        </xs:extension>
                                    </xs:simpleContent>
                                </xs:complexType>
                            </xs:element>
                            <xs:element name="permission" maxOccurs="unbounded" minOccurs="0">
                                <xs:annotation>
                                    <xs:documentation>&lt;user key="user2">&lt;/user></xs:documentation>
                                </xs:annotation>
                                <xs:complexType>
                                    <xs:simpleContent>
                                        <xs:extension base="xs:string">
                                            <xs:attribute type="xs:string" name="key" use="optional"/>
                                        </xs:extension>
                                    </xs:simpleContent>
                                </xs:complexType>
                            </xs:element>
                        </xs:sequence>
                        <xs:attribute type="xs:string" name="key" use="optional"/>
                    </xs:complexType>
                </xs:element>
            </xs:sequence>
        </xs:complexType>
    </xs:element>
</xs:schema>